Code,Grouping,Classification,Specialization,Definition,Effective Date,Deactivation Date,Last Modified Date,Notes,Display Name,Section
2080N0001X,ALLOPATHIC & OSTEOPATHIC PHYSICIANS,PEDIATRICS,NEONATAL-PERINATAL MEDICINE,A PEDIATRICIAN WHO IS THE PRINCIPAL CARE PROVIDER FOR SICK NEWBORN INFANTS. CLINICAL EXPERTISE IS USED FOR DIRECT PATIENT CARE AND FOR CONSULTING WITH OBSTETRICAL COLLEAGUES TO PLAN FOR THE CARE OF MOTHERS WHO HAVE HIGH-RISK PREGNANCIES.,4/1/2003,,7/1/2011,"SOURCE: AMERICAN BOARD OF MEDICAL SPECIALTIES, 2007.  WWW.ABMS.ORG [7/1/2007: DEFINITION ADDED, SOURCE ADDED; 7/1/2011: MODIFIED SOURCE]<BR/>ADDITIONAL RESOURCES: AMERICAN BOARD OF PEDIATRICS, 2007.  HTTP://WWW.ABP.ORG/.  AMERICAN OSTEOPATHIC BOARD OF PEDIATRICS, 2007.  HTTP://WWW.OSTEOPATHIC.ORG/CERTIFICATION<BR/>BOARD CERTIFICATION FOR MEDICAL DOCTORS (MDS) IS PROVIDED BY THE AMERICAN BOARD OF PEDIATRICS.  BOARD CERTIFICATION FOR DOCTORS OF OSTEOPATHY (DOS) IS PROVIDED BY THE AMERICAN OSTEOPATHIC BOARD OF PEDIATRICS.",NEONATAL-PERINATAL MEDICINE PHYSICIAN,INDIVIDUAL
2080P0008X,ALLOPATHIC & OSTEOPATHIC PHYSICIANS,PEDIATRICS,NEURODEVELOPMENTAL DISABILITIES,"A PEDIATRICIAN WHO SPECIALIZES IN THE TREATMENT OF INDIVIDUALS WITH DEVELOPMENTAL DELAYS AND LEARNING DISORDERS ASSOCIATED WITH CEREBRAL PALSY, SPINA BIFIDA, AUTISM, AND OTHER CHRONIC NEUROLOGIC CONDITIONS.",4/1/2003,,7/1/2022,"SOURCE: NATIONAL UNIFORM CLAIM COMMITTEE, WWW.NUCC.ORG",PEDIATRIC NEURODEVELOPMENTAL DISABILITIES PHYSICIAN,INDIVIDUAL
2080B0002X,ALLOPATHIC & OSTEOPATHIC PHYSICIANS,PEDIATRICS,OBESITY MEDICINE,"A PHYSICIAN WHO SPECIALIZES IN THE TREATMENT OF OBESITY DEMONSTRATES COMPETENCY IN AND A THOROUGH UNDERSTANDING OF THE TREATMENT OF OBESITY AND THE GENETIC, BIOLOGIC, ENVIRONMENTAL, SOCIAL, AND BEHAVIORAL FACTORS THAT CONTRIBUTE TO OBESITY. THE OBESITY MEDICINE PHYSICIAN EMPLOYS THERAPEUTIC INTERVENTIONS INCLUDING DIET, PHYSICAL ACTIVITY, BEHAVIORAL CHANGE, AND PHARMACOTHERAPY. THE OBESITY MEDICINE PHYSICIAN UTILIZES A COMPREHENSIVE APPROACH, AND MAY INCLUDE ADDITIONAL RESOURCES SUCH AS DIETITIANS, EXERCISE PHYSIOLOGISTS, MENTAL HEALTH PROFESSIONALS AND BARIATRIC SURGEONS AS INDICATED TO ACHIEVE OPTIMAL RESULTS. ADDITIONALLY, THE OBESITY MEDICINE PHYSICIAN MAINTAINS COMPETENCY IN PROVIDING PRE- PERI- AND POST-SURGICAL CARE OF BARIATRIC SURGERY PATIENTS, PROMOTES THE PREVENTION OF OBESITY, AND ADVOCATES FOR THOSE WHO SUFFER FROM OBESITY.",10/1/2015,,,"SOURCE:  AMERICAN BOARD OF OBESITY MEDICINE, WWW.ABOM.ORG [7/1/2015: NEW]  ADDITIONAL RESOURCE: AMERICAN SOCIETY OF BARIATRIC PHYSICIANS, WWW.ASBP.ORG.",PEDIATRIC OBESITY MEDICINE PHYSICIAN,INDIVIDUAL
2080P0201X,ALLOPATHIC & OSTEOPATHIC PHYSICIANS,PEDIATRICS,PEDIATRIC ALLERGY/IMMUNOLOGY,"A PEDIATRICIAN WHO SPECIALIZES IN THE DIAGNOSIS AND TREATMENT OF ALLERGIES, ALLERGIC REACTIONS, AND IMMUNOLOGIC DISEASES IN CHILDREN.",4/1/2003,,1/1/2010,"SOURCE: NATIONAL UNIFORM CLAIM COMMITTEE, 2009 [1/1/2010: TITLE MODIFIED, DEFINITION ADDED, SOURCE ADDED]    ADDITIONAL RESOURCES: A CERTIFICATION OF SPECIAL QUALIFICATIONS (CSQ) IS ISSUED BY THE AMERICAN OSTEOPATHIC BOARD OF PEDIATRICS.",PEDIATRIC ALLERGY/IMMUNOLOGY PHYSICIAN,INDIVIDUAL
2080P0202X,ALLOPATHIC & OSTEOPATHIC PHYSICIANS,PEDIATRICS,PEDIATRIC CARDIOLOGY,"A PEDIATRIC CARDIOLOGIST PROVIDES COMPREHENSIVE CARE TO PATIENTS WITH CARDIOVASCULAR PROBLEMS. THIS SPECIALIST IS SKILLED IN SELECTING, PERFORMING AND EVALUATING THE STRUCTURAL AND FUNCTIONAL ASSESSMENT OF THE HEART AND BLOOD VESSELS, AND THE CLINICAL EVALUATION OF CARDIOVASCULAR DISEASE.",4/1/2003,,7/1/2011,"SOURCE: AMERICAN BOARD OF MEDICAL SPECIALTIES, 2007.  WWW.ABMS.ORG [7/1/2007: DEFINITION ADDED, SOURCE ADDED; 7/1/2011: MODIFIED SOURCE]<BR/>ADDITIONAL RESOURCES: AMERICAN BOARD OF PEDIATRICS, 2007.  HTTP://WWW.ABP.ORG/.  AMERICAN OSTEOPATHIC BOARD OF PEDIATRICS, 2007.  HTTP://WWW.OSTEOPATHIC.ORG/CERTIFICATION<BR/>BOARD CERTIFICATION FOR MEDICAL DOCTORS (MDS) IS PROVIDED BY THE AMERICAN BOARD OF PEDIATRICS.  BOARD CERTIFICATION FOR DOCTORS OF OSTEOPATHY (DOS) WAS PROVIDED BY THE AMERICAN OSTEOPATHIC BOARD OF PEDIATRICS.  THE CERTIFICATION IS NO LONGER OFFERED.",PEDIATRIC CARDIOLOGY PHYSICIAN,INDIVIDUAL
2080P0203X,ALLOPATHIC & OSTEOPATHIC PHYSICIANS,PEDIATRICS,PEDIATRIC CRITICAL CARE MEDICINE,A PEDIATRICIAN EXPERT IN ADVANCED LIFE SUPPORT FOR CHILDREN FROM THE TERM OR NEAR-TERM NEONATE TO THE ADOLESCENT. THIS COMPETENCE EXTENDS TO THE CRITICAL CARE MANAGEMENT OF LIFE-THREATENING ORGAN SYSTEM FAILURE FROM ANY CAUSE IN BOTH MEDICAL AND SURGICAL PATIENTS AND TO THE SUPPORT OF VITAL PHYSIOLOGICAL FUNCTIONS. THIS SPECIALIST MAY HAVE ADMINISTRATIVE RESPONSIBILITIES FOR INTENSIVE CARE UNITS AND ALSO FACILITATES PATIENT CARE AMONG OTHER SPECIALISTS.,4/1/2003,,7/1/2007,"SOURCE: AMERICAN BOARD OF MEDICAL SPECIALTIES, 2007.  WWW.ABMS.ORG [7/1/2007: DEFINITION CHANGED, SOURCE ADDED]    ADDITIONAL RESOURCES: AMERICAN BOARD OF PEDIATRICS, 2007.  HTTP://WWW.ABP.ORG/.    BOARD CERTIFICATION FOR MEDICAL DOCTORS (MDS) IS PROVIDED BY THE AMERICAN BOARD OF PEDIATRICS.    ACGME ACCREDITED RESIDENCY PROGRAM REQUIREMENTS: 2 YEARS OF TRAINING WITH 3 YEARS PEDIATRICS PLUS 1 YEAR PEDIATRIC CRITICAL CARE FOR CERTIFICATION FOR A TOTAL OF 6 YEARS.    ABMS APPROVED SUBSPECIALTY CERTIFICATE (PEDIATRICS)",PEDIATRIC CRITICAL CARE MEDICINE PHYSICIAN,INDIVIDUAL
2080P0204X,ALLOPATHIC & OSTEOPATHIC PHYSICIANS,PEDIATRICS,PEDIATRIC EMERGENCY MEDICINE,A PEDIATRICIAN WHO HAS SPECIAL QUALIFICATIONS TO MANAGE EMERGENCIES IN INFANTS AND CHILDREN.,4/1/2003,,7/1/2007,"SOURCE: AMERICAN BOARD OF MEDICAL SPECIALTIES, 2007.  WWW.ABMS.ORG [7/1/2007: DEFINITION ADDED, SOURCE ADDED]    ADDITIONAL RESOURCES: AMERICAN BOARD OF PEDIATRICS, 2007.  HTTP://WWW.ABP.ORG/.    BOARD CERTIFICATION FOR MEDICAL DOCTORS (MDS) IS PROVIDED BY THE AMERICAN BOARD OF PEDIATRICS.",PEDIATRIC EMERGENCY MEDICINE (PEDIATRICS) PHYSICIAN,INDIVIDUAL
2080P0205X,ALLOPATHIC & OSTEOPATHIC PHYSICIANS,PEDIATRICS,PEDIATRIC ENDOCRINOLOGY,"A PEDIATRICIAN WHO PROVIDES EXPERT CARE TO INFANTS, CHILDREN AND ADOLESCENTS WHO HAVE DISEASES THAT RESULT FROM AN ABNORMALITY IN THE ENDOCRINE GLANDS (GLANDS WHICH SECRETE HORMONES). THESE DISEASES INCLUDE DIABETES MELLITUS, GROWTH FAILURE, UNUSUAL SIZE FOR AGE, EARLY OR LATE PUBERTAL DEVELOPMENT, BIRTH DEFECTS, THE GENITAL REGION AND DISORDERS OF THE THYROID, THE ADRENAL AND PITUITARY GLANDS.",4/1/2003,,7/1/2011,"SOURCE: AMERICAN BOARD OF MEDICAL SPECIALTIES, 2007.  WWW.ABMS.ORG [7/1/2007: DEFINITION ADDED, SOURCE ADDED; 7/1/2011: MODIFIED SOURCE]<BR/>ADDITIONAL RESOURCES: AMERICAN BOARD OF PEDIATRICS, 2007.  HTTP://WWW.ABP.ORG/.  AMERICAN OSTEOPATHIC BOARD OF PEDIATRICS, 2007.  HTTP://WWW.OSTEOPATHIC.ORG/CERTIFICATION<BR/>BOARD CERTIFICATION FOR MEDICAL DOCTORS (MDS) IS PROVIDED BY THE AMERICAN BOARD OF PEDIATRICS.  BOARD CERTIFICATION FOR DOCTORS OF OSTEOPATHY (DOS) IS PROVIDED BY THE AMERICAN OSTEOPATHIC BOARD OF PEDIATRICS.",PEDIATRIC ENDOCRINOLOGY PHYSICIAN,INDIVIDUAL
2080P0206X,ALLOPATHIC & OSTEOPATHIC PHYSICIANS,PEDIATRICS,PEDIATRIC GASTROENTEROLOGY,"A PEDIATRICIAN WHO SPECIALIZES IN THE DIAGNOSIS AND TREATMENT OF DISEASES OF THE DIGESTIVE SYSTEMS OF INFANTS, CHILDREN AND ADOLESCENTS. THIS SPECIALIST TREATS CONDITIONS SUCH AS ABDOMINAL PAIN, ULCERS, DIARRHEA, CANCER AND JAUNDICE AND PERFORMS COMPLEX DIAGNOSTIC AND THERAPEUTIC PROCEDURES USING LIGHTED SCOPES TO SEE INTERNAL ORGANS.",4/1/2003,,7/1/2007,"SOURCE: AMERICAN BOARD OF MEDICAL SPECIALTIES, 2007.  WWW.ABMS.ORG [7/1/2007: DEFINITION ADDED, SOURCE ADDED]    ADDITIONAL RESOURCES: AMERICAN BOARD OF PEDIATRICS, 2007.  HTTP://WWW.ABP.ORG/.    BOARD CERTIFICATION FOR MEDICAL DOCTORS (MDS) IS PROVIDED BY THE AMERICAN BOARD OF PEDIATRICS.",PEDIATRIC GASTROENTEROLOGY PHYSICIAN,INDIVIDUAL
2080P0207X,ALLOPATHIC & OSTEOPATHIC PHYSICIANS,PEDIATRICS,PEDIATRIC HEMATOLOGY-ONCOLOGY,"A PEDIATRICIAN TRAINED IN THE COMBINATION OF PEDIATRICS, HEMATOLOGY AND ONCOLOGY TO RECOGNIZE AND MANAGE PEDIATRIC BLOOD DISORDERS AND CANCEROUS DISEASES.",4/1/2003,,7/1/2011,"SOURCE: AMERICAN BOARD OF MEDICAL SPECIALTIES, 2007.  WWW.ABMS.ORG [7/1/2007: DEFINITION ADDED, SOURCE ADDED; 7/1/2011: MODIFIED SOURCE]<BR/>ADDITIONAL RESOURCES: AMERICAN BOARD OF PEDIATRICS, 2007.  HTTP://WWW.ABP.ORG/.  AMERICAN OSTEOPATHIC BOARD OF PEDIATRICS, 2007.  HTTP://WWW.OSTEOPATHIC.ORG/CERTIFICATION<BR/>BOARD CERTIFICATION FOR MEDICAL DOCTORS (MDS) IS PROVIDED BY THE AMERICAN BOARD OF PEDIATRICS.  BOARD CERTIFICATION FOR DOCTORS OF OSTEOPATHY (DOS) WAS PROVIDED BY THE AMERICAN OSTEOPATHIC BOARD OF PEDIATRICS.  THE CERTIFICATION IS NO LONGER OFFERED.",PEDIATRIC HEMATOLOGY & ONCOLOGY PHYSICIAN,INDIVIDUAL
2080P0208X,ALLOPATHIC & OSTEOPATHIC PHYSICIANS,PEDIATRICS,PEDIATRIC INFECTIOUS DISEASES,"A PEDIATRICIAN TRAINED TO CARE FOR CHILDREN IN THE DIAGNOSIS, TREATMENT AND PREVENTION OF INFECTIOUS DISEASES. THIS SPECIALIST CAN APPLY SPECIFIC KNOWLEDGE TO AFFECT A BETTER OUTCOME FOR PEDIATRIC INFECTIONS WITH COMPLICATED COURSES, UNDERLYING DISEASES THAT PREDISPOSE TO UNUSUAL OR SEVERE INFECTIONS, UNCLEAR DIAGNOSES, UNCOMMON DISEASES AND COMPLEX OR INVESTIGATIONAL TREATMENTS.",4/1/2003,,7/1/2011,"SOURCE: AMERICAN BOARD OF MEDICAL SPECIALTIES, 2007.  WWW.ABMS.ORG [7/1/2007: DEFINITION ADDED, SOURCE ADDED; 7/1/2011: MODIFIED SOURCE]<BR/>ADDITIONAL RESOURCES: AMERICAN BOARD OF PEDIATRICS, 2007.  HTTP://WWW.ABP.ORG/.  AMERICAN OSTEOPATHIC BOARD OF PEDIATRICS, 2007.  HTTP://WWW.OSTEOPATHIC.ORG/CERTIFICATION<BR/>BOARD CERTIFICATION FOR MEDICAL DOCTORS (MDS) IS PROVIDED BY THE AMERICAN BOARD OF PEDIATRICS.  BOARD CERTIFICATION FOR DOCTORS OF OSTEOPATHY (DOS) WAS PROVIDED BY THE AMERICAN OSTEOPATHIC BOARD OF PEDIATRICS.  THE CERTIFICATION IS NO LONGER OFFERED.",PEDIATRIC INFECTIOUS DISEASES PHYSICIAN,INDIVIDUAL
2080P0210X,ALLOPATHIC & OSTEOPATHIC PHYSICIANS,PEDIATRICS,PEDIATRIC NEPHROLOGY,"A PEDIATRICIAN WHO DEALS WITH THE NORMAL AND ABNORMAL DEVELOPMENT AND MATURATION OF THE KIDNEY AND URINARY TRACT, THE MECHANISMS BY WHICH THE KIDNEY CAN BE DAMAGED, THE EVALUATION AND TREATMENT OF RENAL DISEASES, FLUID AND ELECTROLYTE ABNORMALITIES, HYPERTENSION AND RENAL REPLACEMENT THERAPY.",4/1/2003,,7/1/2011,"SOURCE: AMERICAN BOARD OF MEDICAL SPECIALTIES, 2007.  WWW.ABMS.ORG [7/1/2007: DEFINITION ADDED, SOURCE ADDED; 7/1/2011: MODIFIED SOURCE]<BR/>ADDITIONAL RESOURCES: AMERICAN BOARD OF PEDIATRICS, 2007.  HTTP://WWW.ABP.ORG/.  AMERICAN OSTEOPATHIC BOARD OF PEDIATRICS, 2007.  HTTP://WWW.OSTEOPATHIC.ORG/CERTIFICATION<BR/>BOARD CERTIFICATION FOR MEDICAL DOCTORS (MDS) IS PROVIDED BY THE AMERICAN BOARD OF PEDIATRICS.  BOARD CERTIFICATION FOR DOCTORS OF OSTEOPATHY (DOS) WAS PROVIDED BY THE AMERICAN OSTEOPATHIC BOARD OF PEDIATRICS.  THE CERTIFICATION IS NO LONGER OFFERED.",PEDIATRIC NEPHROLOGY PHYSICIAN,INDIVIDUAL
2080P0214X,ALLOPATHIC & OSTEOPATHIC PHYSICIANS,PEDIATRICS,PEDIATRIC PULMONOLOGY,"A PEDIATRICIAN DEDICATED TO THE PREVENTION AND TREATMENT OF ALL RESPIRATORY DISEASES AFFECTING INFANTS, CHILDREN AND YOUNG ADULTS. THIS SPECIALIST IS KNOWLEDGEABLE ABOUT THE GROWTH AND DEVELOPMENT OF THE LUNG, ASSESSMENT OF RESPIRATORY FUNCTION IN INFANTS AND CHILDREN, AND EXPERIENCED IN A VARIETY OF INVASIVE AND NONINVASIVE DIAGNOSTIC TECHNIQUES.",4/1/2003,,7/1/2011,"SOURCE: AMERICAN BOARD OF MEDICAL SPECIALTIES, 2007.  WWW.ABMS.ORG [7/1/2007: DEFINITION ADDED, SOURCE ADDED; 7/1/2011: MODIFIED SOURCE]<BR/>ADDITIONAL RESOURCES: AMERICAN BOARD OF PEDIATRICS, 2007.  HTTP://WWW.ABP.ORG/.  AMERICAN OSTEOPATHIC BOARD OF PEDIATRICS, 2007.  HTTP://WWW.OSTEOPATHIC.ORG/CERTIFICATION<BR/>BOARD CERTIFICATION FOR MEDICAL DOCTORS (MDS) IS PROVIDED BY THE AMERICAN BOARD OF PEDIATRICS.  BOARD CERTIFICATION FOR DOCTORS OF OSTEOPATHY (DOS) WAS PROVIDED BY THE AMERICAN OSTEOPATHIC BOARD OF PEDIATRICS.  THE CERTIFICATION IS NO LONGER OFFERED.",PEDIATRIC PULMONOLOGY PHYSICIAN,INDIVIDUAL
2080P0216X,ALLOPATHIC & OSTEOPATHIC PHYSICIANS,PEDIATRICS,PEDIATRIC RHEUMATOLOGY,"A PEDIATRICIAN WHO TREATS DISEASES OF JOINTS, MUSCLE, BONES AND TENDONS. A PEDIATRIC RHEUMATOLOGIST DIAGNOSES AND TREATS ARTHRITIS, BACK PAIN, MUSCLE STRAINS, COMMON ATHLETIC INJURIES AND ""COLLAGEN"" DISEASES.",4/1/2003,,7/1/2007,"SOURCE: AMERICAN BOARD OF MEDICAL SPECIALTIES, 2007.  WWW.ABMS.ORG [7/1/2007: DEFINITION ADDED, SOURCE ADDED]    ADDITIONAL RESOURCES: AMERICAN BOARD OF PEDIATRICS, 2007.  HTTP://WWW.ABP.ORG/.    BOARD CERTIFICATION FOR MEDICAL DOCTORS (MDS) IS PROVIDED BY THE AMERICAN BOARD OF PEDIATRICS.",PEDIATRIC RHEUMATOLOGY PHYSICIAN,INDIVIDUAL
2080T0004X,ALLOPATHIC & OSTEOPATHIC PHYSICIANS,PEDIATRICS,PEDIATRIC TRANSPLANT HEPATOLOGY,A PEDIATRICIAN WITH EXPERTISE IN TRANSPLANT HEPATOLOGY ENCOMPASSES THE SPECIAL KNOWLEDGE AND SKILL REQUIRED OF PEDIATRIC GASTROENTEROLOGISTS TO CARE FOR PATIENTS PRIOR TO AND FOLLOWING HEPATIC TRANSPLANTATION; IT SPANS ALL PHASES OF LIVER TRANSPLANTATION.,10/1/2007,,,"SOURCE: AMERICAN BOARD OF MEDICAL SPECIALTIES, 2007.  WWW.ABMS.ORG [7/1/2007: NEW]    ADDITIONAL RESOURCES; AMERICAN BOARD OF PEDIATRICS, 2007.  HTTP://WWW.ABP.ORG/.    BOARD CERTIFICATION FOR MEDICAL DOCTORS (MDS) IS PROVIDED BY THE AMERICAN BOARD OF PEDIATRICS.",PEDIATRIC TRANSPLANT HEPATOLOGY PHYSICIAN,INDIVIDUAL
2080S0012X,ALLOPATHIC & OSTEOPATHIC PHYSICIANS,PEDIATRICS,SLEEP MEDICINE,"A PEDIATRICIAN WHO PRACTICES SLEEP MEDICINE IS CERTIFIED IN THE SUBSPECIALTY OF SLEEP MEDICINE AND SPECIALIZES IN THE CLINICAL ASSESSMENT, PHYSIOLOGIC TESTING, DIAGNOSIS, MANAGEMENT AND PREVENTION OF SLEEP AND CIRCADIAN RHYTHM DISORDERS. SLEEP SPECIALISTS TREAT PATIENTS OF ANY AGE AND USE MULTIDISCIPLINARY APPROACHES. DISORDERS MANAGED BY SLEEP SPECIALISTS INCLUDE, BUT ARE NOT LIMITED TO, SLEEP RELATED BREATHING DISORDERS, INSOMNIA, HYPERSOMNIAS, CIRCADIAN RHYTHM SLEEP DISORDERS, PARASOMNIAS AND SLEEP RELATED MOVEMENT DISORDERS.",10/1/2006,,,"SOURCE: AMERICAN ACADEMY OF SLEEP MEDICINE, WWW.AASM.ORG [7/1/2006: NEW]",PEDIATRIC SLEEP MEDICINE PHYSICIAN,INDIVIDUAL
2080S0010X,ALLOPATHIC & OSTEOPATHIC PHYSICIANS,PEDIATRICS,SPORTS MEDICINE,"A PEDIATRICIAN WHO IS RESPONSIBLE FOR CONTINUOUS CARE IN THE FIELD OF SPORTS MEDICINE, NOT ONLY FOR THE ENHANCEMENT OF HEALTH AND FITNESS, BUT ALSO FOR THE PREVENTION OF INJURY AND ILLNESS. A SPORTS MEDICINE PHYSICIAN MUST HAVE KNOWLEDGE AND EXPERIENCE IN THE PROMOTION OF WELLNESS AND THE PREVENTION OF INJURY. KNOWLEDGE ABOUT SPECIAL AREAS OF MEDICINE SUCH AS EXERCISE PHYSIOLOGY, BIOMECHANICS, NUTRITION, PSYCHOLOGY, PHYSICAL REHABILITATION, EPIDEMIOLOGY, PHYSICAL EVALUATION, INJURIES (TREATMENT AND PREVENTION AND REFERRAL PRACTICE) AND THE ROLE OF EXERCISE IN PROMOTING A HEALTHY LIFESTYLE ARE ESSENTIAL TO THE PRACTICE OF SPORTS MEDICINE. THE SPORTS MEDICINE PHYSICIAN REQUIRES SPECIAL EDUCATION TO PROVIDE THE KNOWLEDGE TO IMPROVE THE HEALTHCARE OF THE INDIVIDUAL ENGAGED IN PHYSICAL EXERCISE (SPORTS) WHETHER AS AN INDIVIDUAL OR IN TEAM PARTICIPATION.",4/1/2003,,7/1/2011,"SOURCE: AMERICAN BOARD OF MEDICAL SPECIALTIES, 2007.  WWW.ABMS.ORG [7/1/2007: DEFINITION ADDED, SOURCE ADDED; 7/1/2011: MODIFIED SOURCE]<BR/>ADDITIONAL RESOURCES: AMERICAN BOARD OF PEDIATRICS, 2007.  HTTP://WWW.ABP.ORG/.  AMERICAN OSTEOPATHIC BOARD OF PEDIATRICS, 2007.  HTTP://WWW.OSTEOPATHIC.ORG/CERTIFICATION<BR/>BOARD CERTIFICATION FOR MEDICAL DOCTORS (MDS) IS PROVIDED BY THE AMERICAN BOARD OF PEDIATRICS.  BOARD CERTIFICATION FOR DOCTORS OF OSTEOPATHY (DOS) IS PROVIDED BY THE AMERICAN OSTEOPATHIC BOARD OF PEDIATRICS.",PEDIATRIC SPORTS MEDICINE PHYSICIAN,INDIVIDUAL
202K00000X,ALLOPATHIC & OSTEOPATHIC PHYSICIANS,PHLEBOLOGY,,"PHLEBOLOGY IS THE MEDICAL DISCIPLINE THAT INVOLVES THE DIAGNOSIS AND TREATMENT OF VENOUS DISORDERS, INCLUDING SPIDER VEINS, VARICOSE VEINS, CHRONIC VENOUS INSUFFICIENCY, VENOUS LEG ULCERS, CONGENITAL VENOUS ABNORMALITIES, VENOUS THROMBOEMBOLISM AND OTHER DISORDERS OF VENOUS ORIGIN.   A PHLEBOLOGIST HAS ATTAINED A MINIMUM OF 50 HOURS OF CME UNITS IN PHLEBOLOGY-RELATED COURSES, AND IS KNOWLEDGEABLE OF AND TRAINED IN A VARIETY OF DIAGNOSTIC TECHNIQUES INCLUDING PHYSICAL EXAMINATION, VENOUS IMAGING TECHNIQUES SUCH AS DUPLEX ULTRASOUND, CT AND MR, PLETHYSMOGRAPHIC TECHNIQUES AND LABORATORY EVALUATION RELATED TO VENOUS THROMBOEMBOLISM.  THE PHLEBOLOGIST IS ALSO TRAINED IN A VARIETY OF THERAPEUTIC INTERVENTIONS, WHICH MAY INCLUDE COMPRESSION, SCLEROTHERAPY, CUTANEOUS VASCULAR LASER, ENDOVENOUS THERMOABLATION PROCEDURES (LASER AND RADIOFREQUENCY) ENDOVENOUS CHEMICAL ABLATION, SURGICAL PROCEDURES (E.G., AMBULATORY PHLEBECTOMY, VENOUS LIGATION), VASOACTIVE MEDICATIONS AND THE MANAGEMENT OF VENOUS THROMBOEMBOLISM.",4/1/2007,,,"SOURCE: AMERICAN COLLEGE OF PHLEBOLOGY 12/2006. WWW.PHELBOLOGY.ORG [1/1/2007: NEW, 7/1/2009: DEFINITION REFORMATTED]    ADDITIONAL RESOURCES: TRAINING PROGRAMS, FELLOWSHIPS, AND/OR PRECEPTORSHIPS: CERTIFICATION EXAM IS BEING ESTABLISHED BY THE AMERICAN BOARD OF PHLEBOLOGY. ACGME ACCREDITED RESIDENCY PROGRAM REQUIREMENTS: NONE",PHLEBOLOGY PHYSICIAN,INDIVIDUAL
208100000X,ALLOPATHIC & OSTEOPATHIC PHYSICIANS,PHYSICAL MEDICINE & REHABILITATION,,"PHYSICAL MEDICINE AND REHABILITATION, ALSO REFERRED TO AS REHABILITATION MEDICINE, IS THE MEDICAL SPECIALTY CONCERNED WITH DIAGNOSING, EVALUATING, AND TREATING PATIENTS WITH PHYSICAL DISABILITIES. THESE DISABILITIES MAY ARISE FROM CONDITIONS AFFECTING THE MUSCULOSKELETAL SYSTEM SUCH AS NECK AND BACK PAIN, SPORTS INJURIES, OR OTHER PAINFUL CONDITIONS AFFECTING THE LIMBS, SUCH AS CARPAL TUNNEL SYNDROME. ALTERNATIVELY, THE DISABILITIES MAY RESULT FROM NEUROLOGICAL TRAUMA OR DISEASE SUCH AS SPINAL CORD INJURY, HEAD INJURY OR STROKE. A PHYSICIAN CERTIFIED IN PHYSICAL MEDICINE AND REHABILITATION IS OFTEN CALLED A PHYSIATRIST. THE PRIMARY GOAL OF THE PHYSIATRIST IS TO ACHIEVE MAXIMAL RESTORATION OF PHYSICAL, PSYCHOLOGICAL, SOCIAL AND VOCATIONAL FUNCTION THROUGH COMPREHENSIVE REHABILITATION. PAIN MANAGEMENT IS OFTEN AN IMPORTANT PART OF THE ROLE OF THE PHYSIATRIST. FOR DIAGNOSIS AND EVALUATION, A PHYSIATRIST MAY INCLUDE THE TECHNIQUES OF ELECTROMYOGRAPHY TO SUPPLEMENT THE STANDARD HISTORY, PHYSICAL, X-RAY AND LABORATORY EXAMINATIONS. THE PHYSIATRIST HAS EXPERTISE IN THE APPROPRIATE USE OF THERAPEUTIC EXERCISE, PROSTHETICS (ARTIFICIAL LIMBS), ORTHOTICS AND MECHANICAL AND ELECTRICAL DEVICES.",4/1/2003,,7/1/2011,"SOURCE: AMERICAN BOARD OF MEDICAL SPECIALTIES, 2007.  WWW.ABMS.ORG [7/1/2007: DEFINITION ADDED, SOURCE ADDED; 7/1/2011: MODIFIED SOURCE]<BR/>ADDITIONAL RESOURCES: AMERICAN BOARD OF PHYSICAL MEDICINE AND REHABILITATION, 2007.  HTTP://WWW.ABPMR.ORG/.  AMERICAN OSTEOPATHIC BOARD OF PHYSICAL MEDICINE AND REHABILITATION, 2007.  HTTP://WWW.OSTEOPATHIC.ORG/CERTIFICATION<BR/>BOARD CERTIFICATION FOR MEDICAL DOCTORS (MDS) IS PROVIDED BY THE AMERICAN BOARD OF PHYSICAL MEDICINE AND REHABILITATION.  BOARD CERTIFICATION FOR DOCTORS OF OSTEOPATHY (DOS) IS PROVIDED BY THE AMERICAN OSTEOPATHIC BOARD OF PHYSICAL MEDICINE AND REHABILITATION.",PHYSICAL MEDICINE & REHABILITATION PHYSICIAN,INDIVIDUAL
2081P0301X,ALLOPATHIC & OSTEOPATHIC PHYSICIANS,PHYSICAL MEDICINE & REHABILITATION,BRAIN INJURY MEDICINE,"A BRAIN INJURY MEDICINE PHYSICIAN SPECIALIZES IN DISORDERS OF BRAIN FUNCTION DUE TO INJURY AND DISEASE.  THESE DISORDERS ENCOMPASS A RANGE OF MEDICAL, PHYSICAL, NEUROLOGIC, COGNITIVE, SENSORY, AND BEHAVIORAL DISORDERS THAT RESULT IN PSYCHOSOCIAL, EDUCATIONAL, AND VOCATIONAL CONSEQUENCES.",4/1/2016,,,"SOURCE: AMERICAN BOARD OF PHYSICAL MEDICINE AND REHABILITATION, 2015. WWW.ABPMR.ORG [1/1/2016: NEW]",BRAIN INJURY MEDICINE (PHYSICAL MEDICINE & REHABILITATION) PHYSICIAN,INDIVIDUAL
2081H0002X,ALLOPATHIC & OSTEOPATHIC PHYSICIANS,PHYSICAL MEDICINE & REHABILITATION,HOSPICE & PALLIATIVE MEDICINE,"A PHYSICAL MEDICINE AND REHABILITATION PHYSICIAN WITH SPECIAL KNOWLEDGE AND SKILLS TO PREVENT AND RELIEVE THE SUFFERING EXPERIENCED BY PATIENTS WITH LIFE-LIMITING ILLNESSES. THIS SPECIALIST WORKS WITH AN INTERDISCIPLINARY HOSPICE OR PALLIATIVE CARE TEAM TO MAXIMIZE QUALITY OF LIFE WHILE ADDRESSING PHYSICAL, PSYCHOLOGICAL, SOCIAL AND SPIRITUAL NEEDS OF BOTH PATIENT AND FAMILY THROUGHOUT THE COURSE OF THE DISEASE, THROUGH THE DYING PROCESS, AND BEYOND FOR THE FAMILY.  THIS SPECIALIST HAS EXPERTISE IN THE ASSESSMENT OF PATIENTS WITH ADVANCED DISEASE; THE RELIEF OF DISTRESSING SYMPTOMS; THE COORDINATION OF INTERDISCIPLINARY PATIENT AND FAMILY-CENTERED CARE IN DIVERSE VENUES; THE USE OF SPECIALIZED CARE SYSTEMS INCLUDING HOSPICE; THE MANAGEMENT OF THE IMMINENTLY DYING PATIENT; AND LEGAL AND ETHICAL DECISION MAKING IN END-OF-LIFE CARE.",4/1/2007,,,"SOURCE: AMERICAN ACADEMY OF HOSPICE AND PALLIATIVE MEDICINE, WWW.AAHPM.ORG [1/1/2007: NEW]",HOSPICE & PALLIATIVE MEDICINE (PHYSICAL MEDICINE & REHABILITATION) PHYSICIAN,INDIVIDUAL
2081N0008X,ALLOPATHIC & OSTEOPATHIC PHYSICIANS,PHYSICAL MEDICINE & REHABILITATION,NEUROMUSCULAR MEDICINE,"A PHYSICIAN WHO SPECIALIZES IN NEUROMUSCULAR MEDICINE POSSESSES SPECIALIZED KNOWLEDGE IN THE SCIENCE, CLINICAL EVALUATION AND MANAGEMENT OF THESE DISORDERS. THIS ENCOMPASSES THE KNOWLEDGE OF THE PATHOLOGY, DIAGNOSIS AND TREATMENT OF THESE DISORDERS AT A LEVEL THAT IS SIGNIFICANTLY BEYOND THE TRAINING AND KNOWLEDGE EXPECTED OF A GENERAL NEUROLOGIST, CHILD NEUROLOGIST OR PHYSIATRIST.",10/1/2007,,,"SOURCE: AMERICAN BOARD OF MEDICAL SPECIALTIES, 2007.  WWW.ABMS.ORG [7/1/2007: NEW]    ADDITIONAL RESOURCES: AMERICAN BOARD OF PHYSICAL MEDICINE AND REHABILITATION, 2007.  HTTP://WWW.ABPMR.ORG/.     BOARD CERTIFICATION FOR MEDICAL DOCTORS (MDS) IS PROVIDED BY THE AMERICAN BOARD OF PHYSICAL MEDICINE AND REHABILITATION. ",NEUROMUSCULAR MEDICINE (PHYSICAL MEDICINE & REHABILITATION) PHYSICIAN,INDIVIDUAL
2081P2900X,ALLOPATHIC & OSTEOPATHIC PHYSICIANS,PHYSICAL MEDICINE & REHABILITATION,PAIN MEDICINE,"A PHYSICIAN WHO PROVIDES A HIGH LEVEL OF CARE, EITHER AS A PRIMARY PHYSICIAN OR CONSULTANT, FOR PATIENTS EXPERIENCING PROBLEMS WITH ACUTE, CHRONIC OR CANCER PAIN IN BOTH HOSPITAL AND AMBULATORY SETTINGS. PATIENT CARE NEEDS MAY ALSO BE COORDINATED WITH OTHER SPECIALISTS. ",4/1/2003,,7/1/2007,"SOURCE: AMERICAN BOARD OF MEDICAL SPECIALTIES, 2007.  WWW.ABMS.ORG [7/1/2007: DEFINITION CHANGED, SOURCE CHANGED]    ADDITIONAL RESOURCES: AMERICAN BOARD OF PHYSICAL MEDICINE AND REHABILITATION, 2007.  HTTP://WWW.ABPMR.ORG/.     BOARD CERTIFICATION FOR MEDICAL DOCTORS (MDS) IS PROVIDED BY THE AMERICAN BOARD OF PHYSICAL MEDICINE AND REHABILITATION.    A SUBSPECIALTY CERTIFICATE  WAS APPROVED BY THE ABMS IN 1999.    ACGME ACCREDITED RESIDENCY PROGRAM REQUIREMENTS:  PROPOSAL UNDER DEVELOPMENT.",PAIN MEDICINE (PHYSICAL MEDICINE & REHABILITATION) PHYSICIAN,INDIVIDUAL
2081P0010X,ALLOPATHIC & OSTEOPATHIC PHYSICIANS,PHYSICAL MEDICINE & REHABILITATION,PEDIATRIC REHABILITATION MEDICINE,"A PHYSIATRIST WHO UTILIZES AN INTERDISCIPLINARY APPROACH AND ADDRESSES THE PREVENTION, DIAGNOSIS, TREATMENT AND MANAGEMENT OF CONGENITAL AND CHILDHOOD-ONSET PHYSICAL IMPAIRMENTS INCLUDING RELATED OR SECONDARY MEDICAL, PHYSICAL, FUNCTIONAL, PSYCHOSOCIAL AND VOCATIONAL LIMITATIONS OR CONDITIONS, WITH AN UNDERSTANDING OF THE LIFE COURSE OF DISABILITY. THIS PHYSICIAN IS TRAINED IN THE IDENTIFICATION OF FUNCTIONAL CAPABILITIES AND SELECTION OF THE BEST OF REHABILITATION INTERVENTION STRATEGIES, WITH AN UNDERSTANDING OF THE CONTINUUM OF CARE.",4/1/2003,,7/1/2007,"SOURCE: AMERICAN BOARD OF MEDICAL SPECIALTIES, 2007.  WWW.ABMS.ORG [7/1/2007: DEFINITION CHANGED, SOURCE ADDED]    ADDITIONAL RESOURCES: AMERICAN BOARD OF PHYSICAL MEDICINE AND REHABILITATION, 2007.  HTTP://WWW.ABPMR.ORG/.     BOARD CERTIFICATION FOR MEDICAL DOCTORS (MDS) IS PROVIDED BY THE AMERICAN BOARD OF PHYSICAL MEDICINE AND REHABILITATION.    A SUBSPECIALTY CERTIFICATE FOR PRM WAS APPROVED BY THE ABMS IN 1999.    ACGME ACCREDITED RESIDENCY PROGRAM REQUIREMENTS:  EARLY DISCUSSIONS UNDERWAY",PEDIATRIC REHABILITATION MEDICINE PHYSICIAN,INDIVIDUAL
2081P0004X,ALLOPATHIC & OSTEOPATHIC PHYSICIANS,PHYSICAL MEDICINE & REHABILITATION,SPINAL CORD INJURY MEDICINE,"A PHYSICIAN WHO ADDRESSES THE PREVENTION, DIAGNOSIS, TREATMENT AND MANAGEMENT OF TRAUMATIC SPINAL CORD INJURY AND NON-TRAUMATIC ETIOLOGIES OF SPINAL CORD DYSFUNCTION BY WORKING IN AN INTERDISCIPLINARY MANNER. CARE IS PROVIDED TO PATIENTS OF ALL AGES ON A LIFELONG BASIS AND COVERS RELATED MEDICAL, PHYSICAL, PSYCHOLOGICAL AND VOCATIONAL DISABILITIES AND COMPLICATIONS. ",4/1/2003,,7/1/2007,"SOURCE: AMERICAN BOARD OF MEDICAL SPECIALTIES, 2007.  WWW.ABMS.ORG [7/1/2007: DEFINITION CHANGED, SOURCE ADDED]    ADDITIONAL RESOURCES: AMERICAN BOARD OF PHYSICAL MEDICINE AND REHABILITATION, 2007.  HTTP://WWW.ABPMR.ORG/.     BOARD CERTIFICATION FOR MEDICAL DOCTORS (MDS) IS PROVIDED BY THE AMERICAN BOARD OF PHYSICAL MEDICINE AND REHABILITATION.    ACGME ACCREDITED RESIDENCY PROGRAM REQUIREMENTS:   1 YEAR OF TRAINING WITH 3-5 YEARS IN RELEVANT SPECIALTY FOR A TOTAL OF 4-6 YEARS.    ABMS APPROVED SUBSPECIALTY CERTIFICATE:  (PHYSICAL MEDICINE AND REHABILITATION)",SPINAL CORD INJURY MEDICINE PHYSICIAN,INDIVIDUAL
2081S0010X,ALLOPATHIC & OSTEOPATHIC PHYSICIANS,PHYSICAL MEDICINE & REHABILITATION,SPORTS MEDICINE,"A PHYSICIAN WHO SPECIALIZES IN SPORTS MEDICINE IS RESPONSIBLE FOR CONTINUOUS CARE RELATED TO THE ENHANCEMENT OF HEALTH AND FITNESS AS WELL AS THE PREVENTION OF INJURY AND ILLNESS. THE SPECIALIST POSSESSES KNOWLEDGE AND EXPERIENCE IN THE PROMOTION OF WELLNESS AND THE PREVENTION OF INJURY FROM MANY AREAS OF MEDICINE SUCH AS EXERCISE PHYSIOLOGY, BIOMECHANICS, NUTRITION, PSYCHOLOGY, PHYSICAL REHABILITATION, EPIDEMIOLOGY, PHYSICAL EVALUATION AND INJURIES. IT IS THE GOAL OF A SPORTS MEDICINE SPECIALIST TO IMPROVE THE HEALTHCARE OF THE INDIVIDUAL ENGAGED IN PHYSICAL EXERCISE.",4/1/2003,,,"SOURCE:  AMERICAN BOARD OF MEDICAL SPECIALTIES, 2009.  WWW.ABMS.ORG [7/1/2009: DEFINITION ADDED]",SPORTS MEDICINE (PHYSICAL MEDICINE & REHABILITATION) PHYSICIAN,INDIVIDUAL
