Code,Grouping,Classification,Specialization,Definition,Effective Date,Deactivation Date,Last Modified Date,Notes,Display Name,Section
193200000X,GROUP,MULTI-SPECIALTY,,"A BUSINESS GROUP OF ONE OR MORE INDIVIDUAL PRACTITIONERS, WHO PRACTICE WITH DIFFERENT AREAS OF SPECIALIZATION.",10/1/2003,,,[7/1/2003: NEW],MULTI-SPECIALTY GROUP,INDIVIDUAL
193400000X,GROUP,SINGLE SPECIALTY,,"A BUSINESS GROUP OF ONE OR MORE INDIVIDUAL PRACTITIONERS, ALL OF WHO PRACTICE WITH THE SAME AREA OF SPECIALIZATION.",10/1/2003,,,[7/1/2003: NEW],SINGLE SPECIALTY GROUP,INDIVIDUAL
207K00000X,ALLOPATHIC & OSTEOPATHIC PHYSICIANS,ALLERGY & IMMUNOLOGY,,"AN ALLERGIST-IMMUNOLOGIST IS TRAINED IN EVALUATION, PHYSICAL AND LABORATORY DIAGNOSIS, AND MANAGEMENT OF DISORDERS INVOLVING THE IMMUNE SYSTEM. SELECTED EXAMPLES OF SUCH CONDITIONS INCLUDE ASTHMA, ANAPHYLAXIS, RHINITIS, ECZEMA, AND ADVERSE REACTIONS TO DRUGS, FOODS, AND INSECT STINGS AS WELL AS IMMUNE DEFICIENCY DISEASES (BOTH ACQUIRED AND CONGENITAL), DEFECTS IN HOST DEFENSE, AND PROBLEMS RELATED TO AUTOIMMUNE DISEASE, ORGAN TRANSPLANTATION, OR MALIGNANCIES OF THE IMMUNE SYSTEM.",4/1/2003,,7/1/2007,"SOURCE: AMERICAN BOARD OF MEDICAL SPECIALTIES, 2007, WWW.ABMS.ORG  [7/1/2007: ADDED DEFINITION, ADDED SOURCE]  ADDITIONAL RESOURCES: AMERICAN BOARD OF ALLERGY AND IMMUNOLOGY, 2007.  HTTP://WWW.ABAI.ORG/   NO SUBSPECIALTY CERTIFICATES IN ALLERGY AND IMMUNOLOGY ARE OFFERED BY THE AMERICAN BOARD OF ALLERGY AND IMMUNOLOGY (ABAI). THE ABAI, HOWEVER, DOES OFFER FORMAL SPECIAL PATHWAYS FOR PHYSICIANS SEEKING DUAL CERTIFICATION IN ALLERGY/IMMUNOLOGY AND PEDIATRIC PULMONOLOGY; ALLERGY/IMMUNOLOGY AND PEDIATRIC RHEUMATOLOGY; AND ALLERGY/IMMUNOLOGY AND ADULT RHEUMATOLOGY.",ALLERGY & IMMUNOLOGY PHYSICIAN,INDIVIDUAL
207KA0200X,ALLOPATHIC & OSTEOPATHIC PHYSICIANS,ALLERGY & IMMUNOLOGY,ALLERGY,DEFINITION TO COME...,4/1/2003,,,,ALLERGY PHYSICIAN,INDIVIDUAL
207KI0005X,ALLOPATHIC & OSTEOPATHIC PHYSICIANS,ALLERGY & IMMUNOLOGY,CLINICAL & LABORATORY IMMUNOLOGY,DEFINITION TO COME...,4/1/2003,,,,CLINICAL & LABORATORY IMMUNOLOGY (ALLERGY & IMMUNOLOGY) PHYSICIAN,INDIVIDUAL
207L00000X,ALLOPATHIC & OSTEOPATHIC PHYSICIANS,ANESTHESIOLOGY,,"AN ANESTHESIOLOGIST IS TRAINED TO PROVIDE PAIN RELIEF AND MAINTENANCE, OR RESTORATION, OF A STABLE CONDITION DURING AND IMMEDIATELY FOLLOWING AN OPERATION OR AN OBSTETRIC OR DIAGNOSTIC PROCEDURE. THE ANESTHESIOLOGIST ASSESSES THE RISK OF THE PATIENT UNDERGOING SURGERY AND OPTIMIZES THE PATIENT'S CONDITION PRIOR TO, DURING AND AFTER SURGERY. IN ADDITION TO THESE MANAGEMENT RESPONSIBILITIES, THE ANESTHESIOLOGIST PROVIDES MEDICAL MANAGEMENT AND CONSULTATION IN PAIN MANAGEMENT AND CRITICAL CARE MEDICINE. ANESTHESIOLOGISTS DIAGNOSE AND TREAT ACUTE, LONG-STANDING AND CANCER PAIN PROBLEMS; DIAGNOSE AND TREAT PATIENTS WITH CRITICAL ILLNESSES OR SEVERE INJURIES; DIRECT RESUSCITATION IN THE CARE OF PATIENTS WITH CARDIAC OR RESPIRATORY EMERGENCIES, INCLUDING THE NEED FOR ARTIFICIAL VENTILATION; AND SUPERVISE POST-ANESTHESIA RECOVERY.",4/1/2003,,7/1/2011,"SOURCE: AMERICAN BOARD OF MEDICAL SPECIALTIES, 2007.  WWW.ABMS.ORG [7/1/2007:  ADDED DEFINITION, ADDED SOURCE; 7/1/2011: MODIFIED SOURCE]<BR/>ADDITIONAL RESOURCES: AMERICAN BOARD OF ANESTHESIOLOGY, 2007.  HTTP://WWW.THEABA.ORG/; AMERICAN OSTEOPATHIC BOARD OF ANESTHESIOLOGY, 2007, HTTP://WWW.OSTEOPATHIC.ORG/CERTIFICATION<BR/>BOARD CERTIFICATION FOR MEDICAL DOCTORS (MDS) IS PROVIDED BY THE AMERICAN BOARD OF ANESTHESIOLOGY.  BOARD CERTIFICATION FOR DOCTORS OF OSTEOPATHY (DOS) IS PROVIDED BY THE AMERICAN OSTEOPATHIC BOARD OF ANESTHESIOLOGY.",ANESTHESIOLOGY PHYSICIAN,INDIVIDUAL
207LA0401X,ALLOPATHIC & OSTEOPATHIC PHYSICIANS,ANESTHESIOLOGY,ADDICTION MEDICINE,AN ANESTHESIOLOGIST WHO SPECIALIZES IN THE DIAGNOSIS AND TREATMENT OF ADDICTIONS.,4/1/2003,,1/1/2010,"SOURCE: NATIONAL UNIFORM CLAIM COMMITTEE, 2009 [1/1/2010: DEFINITION ADDED, SOURCE ADDED]    ADDITIONAL RESOURCES: A CERTIFICATION OF ADDED QUALIFICATIONS (CAQ) WAS, BUT IS NO LONGER ISSUED BY THE AMERICAN OSTEOPATHIC BOARD OF ANESTHESIOLOGY. ",ADDICTION MEDICINE (ANESTHESIOLOGY) PHYSICIAN,INDIVIDUAL
207LC0200X,ALLOPATHIC & OSTEOPATHIC PHYSICIANS,ANESTHESIOLOGY,CRITICAL CARE MEDICINE,"AN ANESTHESIOLOGIST, WHO SPECIALIZES IN CRITICAL CARE MEDICINE DIAGNOSES, TREATS AND SUPPORTS PATIENTS WITH MULTIPLE ORGAN DYSFUNCTION. THIS SPECIALIST MAY HAVE ADMINISTRATIVE RESPONSIBILITIES FOR INTENSIVE CARE UNITS AND MAY ALSO FACILITATE AND COORDINATE PATIENT CARE AMONG THE PRIMARY PHYSICIAN, THE CRITICAL CARE STAFF AND OTHER SPECIALISTS.",4/1/2003,,7/1/2011,"SOURCE: AMERICAN BOARD OF MEDICAL SPECIALTIES, 2007.  WWW.ABMS.ORG [7/1/2007:  ADDED DEFINITION, ADDED SOURCE; 7/1/2011: MODIFIED SOURCE]<BR/>ADDITIONAL RESOURCES: AMERICAN BOARD OF ANESTHESIOLOGY, 2007.  HTTP://WWW.THEABA.ORG/; AMERICAN OSTEOPATHIC BOARD OF ANESTHESIOLOGY, 2007, HTTP://WWW.OSTEOPATHIC.ORG/CERTIFICATION<BR/>BOARD CERTIFICATION FOR MEDICAL DOCTORS (MDS) IS PROVIDED BY THE AMERICAN BOARD OF ANESTHESIOLOGY.  BOARD CERTIFICATION FOR DOCTORS OF OSTEOPATHY (DOS) IS PROVIDED BY THE AMERICAN OSTEOPATHIC BOARD OF ANESTHESIOLOGY.",CRITICAL CARE MEDICINE (ANESTHESIOLOGY) PHYSICIAN,INDIVIDUAL
207LH0002X,ALLOPATHIC & OSTEOPATHIC PHYSICIANS,ANESTHESIOLOGY,HOSPICE & PALLIATIVE MEDICINE,"AN ANESTHESIOLOGIST WITH SPECIAL KNOWLEDGE AND SKILLS TO PREVENT AND RELIEVE THE SUFFERING EXPERIENCED BY PATIENTS WITH LIFE-LIMITING ILLNESSES. THIS SPECIALIST WORKS WITH AN INTERDISCIPLINARY HOSPICE OR PALLIATIVE CARE TEAM TO MAXIMIZE QUALITY OF LIFE WHILE ADDRESSING PHYSICAL, PSYCHOLOGICAL, SOCIAL AND SPIRITUAL NEEDS OF BOTH PATIENT AND FAMILY THROUGHOUT THE COURSE OF THE DISEASE, THROUGH THE DYING PROCESS, AND BEYOND FOR THE FAMILY.  THIS SPECIALIST HAS EXPERTISE IN THE ASSESSMENT OF PATIENTS WITH ADVANCED DISEASE; THE RELIEF OF DISTRESSING SYMPTOMS; THE COORDINATION OF INTERDISCIPLINARY PATIENT AND FAMILY-CENTERED CARE IN DIVERSE VENUES; THE USE OF SPECIALIZED CARE SYSTEMS INCLUDING HOSPICE; THE MANAGEMENT OF THE IMMINENTLY DYING PATIENT; AND LEGAL AND ETHICAL DECISION MAKING IN END-OF-LIFE CARE.",4/1/2007,,,"SOURCE: AMERICAN ACADEMY OF HOSPICE AND PALLIATIVE MEDICINE, WWW.AAHPM.ORG [1/1/2007: NEW]",HOSPICE & PALLIATIVE MEDICINE (ANESTHESIOLOGY) PHYSICIAN,INDIVIDUAL
207LP2900X,ALLOPATHIC & OSTEOPATHIC PHYSICIANS,ANESTHESIOLOGY,PAIN MEDICINE,"AN ANESTHESIOLOGIST WHO PROVIDES A HIGH LEVEL OF CARE, EITHER AS A PRIMARY PHYSICIAN OR CONSULTANT, FOR PATIENTS EXPERIENCING PROBLEMS WITH ACUTE, CHRONIC AND/OR CANCER PAIN IN BOTH HOSPITAL AND AMBULATORY SETTINGS. PATIENT CARE NEEDS ARE ALSO COORDINATED WITH OTHER SPECIALISTS.",4/1/2003,,7/1/2011,"SOURCE: AMERICAN BOARD OF MEDICAL SPECIALTIES, 2007.  WWW.ABMS.ORG [7/1/2007:  ADDED DEFINITION, ADDED SOURCE; 7/1/2011: MODIFIED SOURCE]<BR/>ADDITIONAL RESOURCES: AMERICAN BOARD OF ANESTHESIOLOGY, 2007.  HTTP://WWW.THEABA.ORG/; AMERICAN OSTEOPATHIC BOARD OF ANESTHESIOLOGY, 2007, HTTP://WWW.OSTEOPATHIC.ORG/CERTIFICATION<BR/>BOARD CERTIFICATION FOR MEDICAL DOCTORS (MDS) IS PROVIDED BY THE AMERICAN BOARD OF ANESTHESIOLOGY.  BOARD CERTIFICATION FOR DOCTORS OF OSTEOPATHY (DOS) IS PROVIDED BY THE AMERICAN OSTEOPATHIC BOARD OF ANESTHESIOLOGY.",PAIN MEDICINE (ANESTHESIOLOGY) PHYSICIAN,INDIVIDUAL
207LP3000X,ALLOPATHIC & OSTEOPATHIC PHYSICIANS,ANESTHESIOLOGY,PEDIATRIC ANESTHESIOLOGY,"AN ANESTHESIOLOGIST WHO HAS HAD ADDITIONAL SKILL AND EXPERIENCE IN AND IS PRIMARILY CONCERNED WITH THE ANESTHESIA, SEDATION, AND PAIN MANAGEMENT NEEDS OF INFANTS AND CHILDREN.  A PEDIATRIC ANESTHESIOLOGIST GENERALLY PROVIDES SERVICES INCLUDING THE EVALUATION OF COMPLEX MEDICAL PROBLEMS IN INFANTS AND CHILDREN WHEN SURGERY IS NECESSARY,  PLANNING AND CARE FOR CHILDREN BEFORE AND AFTER SURGERY, PAIN CONTROL, ANESTHESIA AND SEDATION FOR ANY PROCEDURES OUT OF THE OPERATING ROOM SUCH AS MRI, CT SCAN, AND RADIATION THERAPY.",10/1/2006,,,"SOURCE: AMERICAN ACADEMY OF PEDIATRICS, WWW.AAP.ORG [7/1/2006: NEW]",PEDIATRIC ANESTHESIOLOGY PHYSICIAN,INDIVIDUAL
208U00000X,ALLOPATHIC & OSTEOPATHIC PHYSICIANS,CLINICAL PHARMACOLOGY,,"CLINICAL PHARMACOLOGY ENCOMPASSES THE SPECTRUM OF ACTIVITIES RELATED TO THE DISCOVERY, DEVELOPMENT, REGULATION, AND UTILIZATION OF SAFE AND EFFECTIVE DRUGS.",4/1/2003,,,"SOURCE: AMERICAN SOCIETY FOR CLINICAL PHARMACOLOGY AND THERAPEUTICS, 2008  [7/1/2008: MODIFIED DEFINITION]    ADDITIONAL RESOURCES: CLINICAL PHARMACOLOGY IS A RECOGNIZED FELLOWSHIP PROGRAM FOR PHYSICIANS, PHARMACISTS, AND POST-DOCTORAL RESEARCHERS DELIVERED THROUGH MEDICAL EDUCATION INSTITUTIONS ACCREDITED BY THE AMERICAN BOARD OF CLINICAL PHARMACOLOGY. HTTP://WWW.ASCPT.ORG/; AMERICAN BOARD OF CLINICAL PHARMACOLOGY HTTP://WWW.ABCP.NET/",CLINICAL PHARMACOLOGY PHYSICIAN,INDIVIDUAL
208C00000X,ALLOPATHIC & OSTEOPATHIC PHYSICIANS,COLON & RECTAL SURGERY,,"A COLON AND RECTAL SURGEON IS TRAINED TO DIAGNOSE AND TREAT VARIOUS DISEASES OF THE INTESTINAL TRACT, COLON, RECTUM, ANAL CANAL AND PERIANAL AREA BY MEDICAL AND SURGICAL MEANS. THIS SPECIALIST ALSO DEALS WITH OTHER ORGANS AND TISSUES (SUCH AS THE LIVER, URINARY AND FEMALE REPRODUCTIVE SYSTEM) INVOLVED WITH PRIMARY INTESTINAL DISEASE.",4/1/2003,,7/1/2007,"SOURCE: AMERICAN BOARD OF MEDICAL SPECIALTIES, 2007.  WWW.ABMS.ORG [7/1/2007:  ADDED DEFINITION, ADDED SOURCE]    ADDITIONAL RESOURCES: AMERICAN BOARD OF COLON AND RECTAL SURGERY, 2007.  HTTP://WWW.ABCRS.ORG/.    BOARD CERTIFICATION FOR MEDICAL DOCTORS (MDS) IS PROVIDED BY THE AMERICAN BOARD OF COLON AND RECTAL SURGERY.    COLON AND RECTAL SURGEONS HAVE THE EXPERTISE TO DIAGNOSE AND OFTEN MANAGE ANORECTAL CONDITIONS SUCH AS HEMORRHOIDS, FISSURES (PAINFUL TEARS IN THE ANAL LINING), ABSCESSES AND FISTULAE (INFECTIONS LOCATED AROUND THE ANUS AND RECTUM) IN THE OFFICE SETTING. THEY ALSO TREAT PROBLEMS OF THE INTESTINE AND COLON, AND PERFORM ENDOSCOPIC PROCEDURES TO EVALUATE AND TREAT PROBLEMS SUCH AS CANCER, POLYPS (PRECANCEROUS GROWTHS) AND INFLAMMATORY CONDITIONS. ",COLON & RECTAL SURGERY PHYSICIAN,INDIVIDUAL
207N00000X,ALLOPATHIC & OSTEOPATHIC PHYSICIANS,DERMATOLOGY,,"A DERMATOLOGIST IS TRAINED TO DIAGNOSE AND TREAT PEDIATRIC AND ADULT PATIENTS WITH BENIGN AND MALIGNANT DISORDERS OF THE SKIN, MOUTH, EXTERNAL GENITALIA, HAIR AND NAILS, AS WELL AS A NUMBER OF SEXUALLY TRANSMITTED DISEASES. THE DERMATOLOGIST HAS HAD ADDITIONAL TRAINING AND EXPERIENCE IN THE DIAGNOSIS AND TREATMENT OF SKIN CANCERS, MELANOMAS, MOLES AND OTHER TUMORS OF THE SKIN, THE MANAGEMENT OF CONTACT DERMATITIS AND OTHER ALLERGIC AND NONALLERGIC SKIN DISORDERS, AND IN THE RECOGNITION OF THE SKIN MANIFESTATIONS OF SYSTEMIC (INCLUDING INTERNAL MALIGNANCY) AND INFECTIOUS DISEASES. DERMATOLOGISTS HAVE SPECIAL TRAINING IN DERMATOPATHOLOGY AND IN THE SURGICAL TECHNIQUES USED IN DERMATOLOGY. THEY ALSO HAVE EXPERTISE IN THE MANAGEMENT OF COSMETIC DISORDERS OF THE SKIN SUCH AS HAIR LOSS AND SCARS AND THE SKIN CHANGES ASSOCIATED WITH AGING.",4/1/2003,,7/1/2007,"SOURCE: AMERICAN BOARD OF MEDICAL SPECIALTIES, 2007.  WWW.ABMS.ORG [7/1/2007: ADDED DEFINITION, ADDED SOURCE]    ADDITIONAL RESOURCES: AMERICAN BOARD OF DERMATOLOGY, 2007.  HTTP://WWW.ABDERM.ORG/    BOARD CERTIFICATION IS PROVIDED BY THE AMERICAN BOARD OF DERMATOLOGY.   ",DERMATOLOGY PHYSICIAN,INDIVIDUAL
207NI0002X,ALLOPATHIC & OSTEOPATHIC PHYSICIANS,DERMATOLOGY,CLINICAL & LABORATORY DERMATOLOGICAL IMMUNOLOGY,A DERMATOLOGIST WHO UTILIZES VARIOUS SPECIALIZED LABORATORY PROCEDURES TO DIAGNOSE DISORDERS CHARACTERIZED BY DEFECTIVE RESPONSES OF THE BODY'S IMMUNE SYSTEM. IMMUNODERMATOLOGISTS ALSO MAY PROVIDE CONSULTATION IN THE MANAGEMENT OF THESE DISORDERS AND ADMINISTER SPECIALIZED FORMS OF THERAPY FOR THESE DISEASES.,4/1/2003,,7/1/2007,"SOURCE: AMERICAN BOARD OF MEDICAL SPECIALTIES, 2007.  WWW.ABMS.ORG  [7/1/2007: ADDED DEFINITION, ADDED SOURCE]    ADDITIONAL RESOURCES: AMERICAN BOARD OF DERMATOLOGY, 2007.  HTTP://WWW.ABDERM.ORG/    BOARD CERTIFICATION IS PROVIDED BY THE AMERICAN BOARD OF DERMATOLOGY.  ",CLINICAL & LABORATORY DERMATOLOGICAL IMMUNOLOGY PHYSICIAN,INDIVIDUAL
207ND0900X,ALLOPATHIC & OSTEOPATHIC PHYSICIANS,DERMATOLOGY,DERMATOPATHOLOGY,"A DERMATOPATHOLOGIST HAS THE EXPERTISE TO DIAGNOSE AND MONITOR DISEASES OF THE SKIN INCLUDING INFECTIOUS, IMMUNOLOGIC, DEGENERATIVE AND NEOPLASTIC DISEASES. THIS ENTAILS THE EXAMINATION AND INTERPRETATION OF SPECIALLY PREPARED TISSUE SECTIONS, CELLULAR SCRAPINGS AND SMEARS OF SKIN LESIONS BY MEANS OF ROUTINE AND SPECIAL (ELECTRON AND FLUORESCENT) MICROSCOPES.",4/1/2003,,7/1/2011,"SOURCE: AMERICAN BOARD OF MEDICAL SPECIALTIES, 2007.  WWW.ABMS.ORG  [7/1/2007: ADDED DEFINITION, ADDED SOURCE; 7/1/2011: MODIFIED SOURCE]<BR/>ADDITIONAL RESOURCES: AMERICAN BOARD OF DERMATOLOGY, 2007.  HTTP://WWW.ABDERM.ORG/; AMERICAN OSTEOPATHIC BOARD OF DERMATOLOGY, 2007. HTTP://WWW.OSTEOPATHIC.ORG/CERTIFICATION<BR/>BOARD CERTIFICATION FOR MEDICAL DOCTORS (MDS) IS PROVIDED BY THE AMERICAN BOARD OF DERMATOLOGY.  BOARD CERTIFICATION FOR DOCTORS OF OSTEOPATHY (DOS) IS PROVIDED BY THE AMERICAN OSTEOPATHIC BOARD OF DERMATOLOGY.",DERMATOPATHOLOGY PHYSICIAN,INDIVIDUAL
207ND0101X,ALLOPATHIC & OSTEOPATHIC PHYSICIANS,DERMATOLOGY,MOHS-MICROGRAPHIC SURGERY,"THE HIGHLY-TRAINED SURGEONS THAT PERFORM MOHS MICROGRAPHIC SURGERY ARE SPECIALISTS BOTH IN DERMATOLOGY AND PATHOLOGY. WITH THEIR EXTENSIVE KNOWLEDGE OF THE SKIN AND UNIQUE PATHOLOGICAL SKILLS, THEY ARE ABLE TO REMOVE ONLY DISEASED TISSUE, PRESERVING HEALTHY TISSUE AND MINIMIZING THE COSMETIC IMPACT OF THE SURGERY.  MOHS SURGEONS WHO BELONG TO THE AMERICAN COLLEGE OF MOHS SURGERY (ACMS) HAVE COMPLETED A MINIMUM OF ONE YEAR OF FELLOWSHIP TRAINING AT ONE OF THE ACMS-APPROVED TRAINING CENTERS IN THE U.S.",4/1/2003,,1/1/2008,"SOURCE: AMERICAN COLLEGE OF MOHS SURGERY, 2007 [1/1/2008: ADDED DEFINITION, ADDED SOURCE]  ADDITIONAL RESOURCES: ADDITIONAL RESOURCES: HTTP://WWW.MOHSCOLLEGE.ORG/; AMERICAN BOARD OF DERMATOLOGY, 2007.  HTTP://WWW.ABDERM.ORG/",MOHS-MICROGRAPHIC SURGERY PHYSICIAN,INDIVIDUAL
207NP0225X,ALLOPATHIC & OSTEOPATHIC PHYSICIANS,DERMATOLOGY,PEDIATRIC DERMATOLOGY,"A PEDIATRIC DERMATOLOGIST HAS, THROUGH ADDITIONAL SPECIAL TRAINING, DEVELOPED EXPERTISE IN THE TREATMENT OF SPECIFIC SKIN DISEASE CATEGORIES WITH EMPHASIS ON THOSE DISEASES WHICH PREDOMINATE IN INFANTS, CHILDREN AND ADOLESCENTS.",4/1/2003,,7/1/2007,"SOURCE: AMERICAN BOARD OF MEDICAL SPECIALTIES, 2007.  WWW.ABMS.ORG [7/1/2007: CHANGED DEFINITION, ADDED SOURCE]    ADDITIONAL RESOURCES: AMERICAN BOARD OF DERMATOLOGY, 2007, HTTP://WWW.ABDERM.ORG/  A SUBSPECIALTY CERTIFICATE WAS APPROVED BY ABMS IN 2000.    ACGME ACCREDITED RESIDENCY PROGRAM REQUIREMENTS:  NONE.",PEDIATRIC DERMATOLOGY PHYSICIAN,INDIVIDUAL
207NS0135X,ALLOPATHIC & OSTEOPATHIC PHYSICIANS,DERMATOLOGY,PROCEDURAL DERMATOLOGY,"PROCEDURAL DERMATOLOGY, A SUBSPECIALTY OF DERMATOLOGY, ENCOMPASSING A WIDE VARIETY OF SURGICAL PROCEDURES AND METHODS TO REMOVE OR MODIFY SKIN TISSUE FOR HEALTH OR COSMETIC BENEFIT. THESE METHODS INCLUDE SCALPEL SURGERY, LASER SURGERY, CHEMICAL SURGERY, CRYOSURGERY (LIQUID NITROGEN), ELECTROSURGERY, ASPIRATION SURGERY, LIPOSUCTION, INJECTION OF FILLER SUBSTANCES, AND MOHS MICROGRAPHIC CONTROLLED SURGERY (A SPECIAL TECHNIQUE FOR THE REMOVAL OF GROWTHS, ESPECIALLY SKIN CANCERS).",4/1/2003,,1/1/2008,"SOURCE: AMERICAN BOARD OF DERMATOLOGY, 2007, WWW.ABDERM.ORG [1/1/2008: DEFINITION ADDED, SOURCE ADDED, TITLE CHANGED]    ADDITIONAL RESOURCES:  SOME ABMS BOARD CERTIFIED DERMATOLOGISTS HAVE COMPLETED A ONE-YEAR ACGME APPROVED FELLOWSHIP IN PROCEDURAL DERMATOLOGY, WHICH HAS BEEN OFFERED SINCE 2003. AT THIS TIME THE ABD DOES NOT OFFER SUBSPECIALTY CERTIFICATION IN PROCEDURAL DERMATOLOGY.",PROCEDURAL DERMATOLOGY PHYSICIAN,INDIVIDUAL
204R00000X,ALLOPATHIC & OSTEOPATHIC PHYSICIANS,ELECTRODIAGNOSTIC MEDICINE,,"ELECTRODIAGNOSTIC MEDICINE IS THE MEDICAL SUBSPECIALTY THAT APPLIES NEUROPHYSIOLOGIC TECHNIQUES TO DIAGNOSE, EVALUATE, AND TREAT PATIENTS WITH IMPAIRMENTS OF THE NEUROLOGIC, NEUROMUSCULAR, AND/OR MUSCULAR SYSTEMS.  QUALIFIED PHYSICIANS ARE TRAINED IN PERFORMING ELECTROPHYSIOLOGICAL TESTING AND INTERPRETATION OF THE TEST DATA.  THEY REQUIRE KNOWLEDGE IN ANATOMY, PHYSIOLOGY, KINESIOLOGY, HISTOLOGY, AND PATHOLOGY OF THE BRAIN, SPINAL CORD, AUTONOMIC NERVES, CRANIAL NERVES, PERIPHERAL NERVES, NEUROMUSCULAR JUNCTION, AND MUSCLES. THEY MUST KNOW CLINICAL FEATURES AND TREATMENT OF DISEASES OF THE CENTRAL, PERIPHERAL, AND AUTONOMIC NERVOUS SYSTEMS, AS WELL AS THOSE OF NEUROMUSCULAR JUNCTION AND MUSCLE. PHYSICIANS ALSO REQUIRE SPECIAL KNOWLEDGE ABOUT ELECTRIC SIGNAL PROCESSING, INCLUDING WAVEFORM ANALYSIS, ELECTRONICS AND INSTRUMENTATION, STIMULATION AND RECORDING EQUIPMENT, AND STATISTICS.",4/1/2011,,,"SOURCE: AMERICAN ASSOCIATION OF NEUROMUSCULAR & ELECTRODIAGNOSTIC MEDICINE, 2011. WWW.AANEM.ORG [1/1/2011: NEW]  ADDITIONAL RESOURCES:  AMERICAN BOARD OF ELECTRODIAGNOSTIC MEDICINE, 2011.  WWW.ABEMEXAM.ORG",ELECTRODIAGNOSTIC MEDICINE PHYSICIAN,INDIVIDUAL
207P00000X,ALLOPATHIC & OSTEOPATHIC PHYSICIANS,EMERGENCY MEDICINE,,"AN EMERGENCY PHYSICIAN FOCUSES ON THE IMMEDIATE DECISION MAKING AND ACTION NECESSARY TO PREVENT DEATH OR ANY FURTHER DISABILITY BOTH IN THE PRE-HOSPITAL SETTING BY DIRECTING EMERGENCY MEDICAL TECHNICIANS AND IN THE EMERGENCY DEPARTMENT. THE EMERGENCY PHYSICIAN PROVIDES IMMEDIATE RECOGNITION, EVALUATION, CARE, STABILIZATION AND DISPOSITION OF A GENERALLY DIVERSIFIED POPULATION OF ADULT AND PEDIATRIC PATIENTS IN RESPONSE TO ACUTE ILLNESS AND INJURY.",4/1/2003,,7/1/2011,"SOURCE: AMERICAN BOARD OF MEDICAL SPECIALTIES, 2007.  WWW.ABMS.ORG [7/1/2007: ADDED DEFINITION, ADDED SOURCE; 7/1/2011: MODIFIED SOURCE]<BR/>ADDITIONAL RESOURCES: AMERICAN BOARD OF EMERGENCY MEDICINE, 2007.  HTTP://WWW.ABEM.ORG/PUBLIC/; AMERICAN OSTEOPATHIC BOARD OF EMERGENCY MEDICINE, 2007. HTTP://WWW.OSTEOPATHIC.ORG/CERTIFICATION<BR/>BOARD CERTIFICATION FOR MEDICAL DOCTORS (MDS) IS PROVIDED BY THE AMERICAN BOARD OF EMERGENCY MEDICINE.  BOARD CERTIFICATION FOR DOCTORS OF OSTEOPATHY (DOS) IS PROVIDED BY THE AMERICAN OSTEOPATHIC BOARD OF EMERGENCY MEDICINE.",EMERGENCY MEDICINE PHYSICIAN,INDIVIDUAL
207PE0004X,ALLOPATHIC & OSTEOPATHIC PHYSICIANS,EMERGENCY MEDICINE,EMERGENCY MEDICAL SERVICES,"AN EMERGENCY MEDICINE PHYSICIAN WHO SPECIALIZES IN NON-HOSPITAL BASED EMERGENCY MEDICAL SERVICES (E.G., DISASTER SITE, ACCIDENT SCENE, TRANSPORT VEHICLE, ETC.) TO PROVIDE PRE-HOSPITAL ASSESSMENT, TREATMENT, AND TRANSPORT PATIENTS.",4/1/2003,,1/1/2010,"SOURCE: NATIONAL UNIFORM CLAIM COMMITTEE, 2009 [1/1/2010: DEFINITION ADDED, SOURCE ADDED]    ADDITIONAL RESOURCES: A CERTIFICATION OF ADDED QUALIFICATIONS (CAQ) IS ISSUED BY THE AMERICAN OSTEOPATHIC BOARD OF EMERGENCY MEDICINE.",EMERGENCY MEDICAL SERVICES (EMERGENCY MEDICINE) PHYSICIAN,INDIVIDUAL
207PH0002X,ALLOPATHIC & OSTEOPATHIC PHYSICIANS,EMERGENCY MEDICINE,HOSPICE & PALLIATIVE MEDICINE,"AN EMERGENCY MEDICINE PHYSICIAN WITH SPECIAL KNOWLEDGE AND SKILLS TO PREVENT AND RELIEVE THE SUFFERING EXPERIENCED BY PATIENTS WITH LIFE-LIMITING ILLNESSES. THIS SPECIALIST WORKS WITH AN INTERDISCIPLINARY HOSPICE OR PALLIATIVE CARE TEAM TO MAXIMIZE QUALITY OF LIFE WHILE ADDRESSING PHYSICAL, PSYCHOLOGICAL, SOCIAL AND SPIRITUAL NEEDS OF BOTH PATIENT AND FAMILY THROUGHOUT THE COURSE OF THE DISEASE, THROUGH THE DYING PROCESS, AND BEYOND FOR THE FAMILY.  THIS SPECIALIST HAS EXPERTISE IN THE ASSESSMENT OF PATIENTS WITH ADVANCED DISEASE; THE RELIEF OF DISTRESSING SYMPTOMS; THE COORDINATION OF INTERDISCIPLINARY PATIENT AND FAMILY-CENTERED CARE IN DIVERSE VENUES; THE USE OF SPECIALIZED CARE SYSTEMS INCLUDING HOSPICE; THE MANAGEMENT OF THE IMMINENTLY DYING PATIENT; AND LEGAL AND ETHICAL DECISION MAKING IN END-OF-LIFE CARE.",4/1/2007,,,"SOURCE: AMERICAN ACADEMY OF HOSPICE AND PALLIATIVE MEDICINE, WWW.AAHPM.ORG [1/1/2007: NEW]",HOSPICE & PALLIATIVE MEDICINE (EMERGENCY MEDICINE) PHYSICIAN,INDIVIDUAL
207PT0002X,ALLOPATHIC & OSTEOPATHIC PHYSICIANS,EMERGENCY MEDICINE,MEDICAL TOXICOLOGY,"MEDICAL TOXICOLOGISTS ARE PHYSICIANS WHO SPECIALIZE IN THE PREVENTION, EVALUATION, TREATMENT AND MONITORING OF INJURY AND ILLNESS FROM EXPOSURES TO DRUGS AND CHEMICALS, AS WELL AS BIOLOGICAL AND RADIOLOGICAL AGENTS. MEDICAL TOXICOLOGISTS CARE FOR PEOPLE IN CLINICAL, ACADEMIC, GOVERNMENTAL AND PUBLIC HEALTH SETTINGS, AND PROVIDE POISON CONTROL CENTER LEADERSHIP. IMPORTANT AREAS OF MEDICAL TOXICOLOGY INCLUDE ACUTE DRUG POISONING, ADVERSE DRUG EVENTS, DRUG ABUSE, ADDICTION AND WITHDRAWAL, CHEMICALS AND HAZARDOUS MATERIALS, TERRORISM PREPAREDNESS, VENOMOUS BITES AND STINGS AND ENVIRONMENTAL AND WORKPLACE EXPOSURES.",4/1/2003,,7/1/2011,"SOURCE: AMERICAN BOARD OF MEDICAL SPECIALTIES, 2007.  WWW.ABMS.ORG [7/1/2007: ADDED DEFINITION, ADDED SOURCE; 7/1/2011: MODIFIED SOURCE]<BR/>ADDITIONAL RESOURCES: AMERICAN BOARD OF EMERGENCY MEDICINE, 2007.  HTTP://WWW.ABEM.ORG/PUBLIC/.   AMERICAN OSTEOPATHIC BOARD OF EMERGENCY MEDICINE, 2007.  HTTP://WWW.OSTEOPATHIC.ORG/CERTIFICATION<BR/>BOARD CERTIFICATION FOR MEDICAL DOCTORS (MDS) IS PROVIDED BY THE AMERICAN BOARD OF EMERGENCY MEDICINE.  BOARD CERTIFICATION FOR DOCTORS OF OSTEOPATHY (DOS) IS PROVIDED BY THE AMERICAN OSTEOPATHIC BOARD OF EMERGENCY MEDICINE.",MEDICAL TOXICOLOGY (EMERGENCY MEDICINE) PHYSICIAN,INDIVIDUAL
207PP0204X,ALLOPATHIC & OSTEOPATHIC PHYSICIANS,EMERGENCY MEDICINE,PEDIATRIC EMERGENCY MEDICINE,PEDIATRIC EMERGENCY MEDICINE IS A CLINICAL SUBSPECIALTY THAT FOCUSES ON THE CARE OF THE ACUTELY ILL OR INJURED CHILD IN THE SETTING OF AN EMERGENCY DEPARTMENT.,4/1/2003,,7/1/2007,"SOURCE: AMERICAN BOARD OF MEDICAL SPECIALTIES, 2007.  WWW.ABMS.ORG [7/1/2007: ADDED DEFINITION, ADDED SOURCE]  ADDITIONAL RESOURCES: AMERICAN BOARD OF EMERGENCY MEDICINE, 2007.  HTTP://WWW.ABEM.ORG/PUBLIC/    BOARD CERTIFICATION IS PROVIDED BY THE AMERICAN BOARD OF EMERGENCY MEDICINE.  BOARD CERTIFICATION FOR MEDICAL DOCTORS (MDS) IS PROVIDED BY THE AMERICAN BOARD OF EMERGENCY MEDICINE.  ",PEDIATRIC EMERGENCY MEDICINE (EMERGENCY MEDICINE) PHYSICIAN,INDIVIDUAL
207PS0010X,ALLOPATHIC & OSTEOPATHIC PHYSICIANS,EMERGENCY MEDICINE,SPORTS MEDICINE,"AN EMERGENCY PHYSICIAN WITH SPECIAL KNOWLEDGE IN SPORTS MEDICINE IS RESPONSIBLE FOR CONTINUOUS CARE IN THE FIELD OF SPORTS MEDICINE, NOT ONLY FOR THE ENHANCEMENT OF HEALTH AND FITNESS, BUT ALSO FOR THE PREVENTION AND MANAGEMENT OF INJURY AND ILLNESS. A SPORTS MEDICINE PHYSICIAN HAS KNOWLEDGE AND EXPERIENCE IN THE PROMOTION OF WELLNESS AND THE ROLE OF EXERCISE IN PROMOTING A HEALTHY LIFESTYLE. KNOWLEDGE OF EXERCISE PHYSIOLOGY, BIOMECHANICS, NUTRITION, PSYCHOLOGY, PHYSICAL REHABILITATION AND EPIDEMIOLOGY IS ESSENTIAL TO THE PRACTICE OF SPORTS MEDICINE.",4/1/2003,,7/1/2011,"SOURCE: AMERICAN BOARD OF MEDICAL SPECIALTIES, 2007.  WWW.ABMS.ORG [7/1/2007: ADDED DEFINITION, ADDED SOURCE; 7/1/2011: MODIFIED SOURCE]<BR/>ADDITIONAL RESOURCES: AMERICAN BOARD OF EMERGENCY MEDICINE, 2007.  HTTP://WWW.ABEM.ORG/PUBLIC/.   AMERICAN OSTEOPATHIC BOARD OF EMERGENCY MEDICINE, 2007.  HTTP://WWW.OSTEOPATHIC.ORG/CERTIFICATION<BR/>BOARD CERTIFICATION FOR MEDICAL DOCTORS (MDS) IS PROVIDED BY THE AMERICAN BOARD OF EMERGENCY MEDICINE.  BOARD CERTIFICATION FOR DOCTORS OF OSTEOPATHY (DOS) IS PROVIDED BY THE AMERICAN OSTEOPATHIC BOARD OF EMERGENCY MEDICINE.",SPORTS MEDICINE (EMERGENCY MEDICINE) PHYSICIAN,INDIVIDUAL
207PE0005X,ALLOPATHIC & OSTEOPATHIC PHYSICIANS,EMERGENCY MEDICINE,UNDERSEA & HYPERBARIC MEDICINE,"A SPECIALIST WHO TREATS DECOMPRESSION ILLNESS AND DIVING ACCIDENT CASES AND USES HYPERBARIC OXYGEN THERAPY TO TREAT SUCH CONDITIONS AS CARBON MONOXIDE POISONING, GAS GANGRENE, NON-HEALING WOUNDS, TISSUE DAMAGE FROM RADIATION AND BURNS, AND BONE INFECTIONS.  THIS SPECIALIST ALSO SERVES AS A CONSULTANT TO OTHER PHYSICIANS IN ALL ASPECTS OF HYPERBARIC CHAMBER OPERATIONS, AND ASSESSES RISKS AND APPLIES APPROPRIATE STANDARDS TO PREVENT DISEASE AND DISABILITY IN DIVERS AND OTHER PERSONS WORKING IN ALTERED ATMOSPHERIC CONDITIONS.",4/1/2003,,,"SOURCE: AMERICAN BOARD OF EMERGENCY MEDICINE [7/1/2008: SOURCE ADDED, ADDITIONAL RESOURCES ADDED]    ADDITIONAL RESOURCES: ADDITIONAL RESOURCES: WWW.ABEM.ORG & AMERICAN BOARD OF PREVENTIVE MEDICINE WWW.ABPREVMED.ORG",UNDERSEA & HYPERBARIC MEDICINE (EMERGENCY MEDICINE) PHYSICIAN,INDIVIDUAL
207Q00000X,ALLOPATHIC & OSTEOPATHIC PHYSICIANS,FAMILY MEDICINE,,"FAMILY MEDICINE IS THE MEDICAL SPECIALTY WHICH IS CONCERNED WITH THE TOTAL HEALTH CARE OF THE INDIVIDUAL AND THE FAMILY. IT IS THE SPECIALTY IN BREADTH WHICH INTEGRATES THE BIOLOGICAL, CLINICAL, AND BEHAVIORAL SCIENCES. THE SCOPE OF FAMILY MEDICINE IS NOT LIMITED BY AGE, SEX, ORGAN SYSTEM, OR DISEASE ENTITY.",4/1/2003,,7/1/2007,"SOURCE:  AMERICAN BOARD OF FAMILY MEDICINE [1/1/2007: CHANGED TITLE; 7/1/2007: ADDED DEFINITION, ADDED SOURCE; 7/1/2017: MODIFIED DEFINITION]<BR/>NOTE:  THE AMERICAN OSTEOPATHIC BOARD OF FAMILY PHYSICIANS CERTIFICATION INCLUDES EXTENSIVE USE OF OSTEOPATHIC MANIPULATIVE TREATMENT (OMT), WHICH INTEGRATES THE BIOLOGICAL, CLINICAL, AND BEHAVIORAL SCIENCES.<BR/>ADDITIONAL RESOURCES:  AMERICAN BOARD OF FAMILY MEDICINE, WWW.THEABFM.ORG.  AMERICAN OSTEOPATHIC BOARD OF FAMILY PHYSICIANS, WWW.OSTEOPATHIC.ORG/CERTIFICATION<BR/>BOARD CERTIFICATION FOR MEDICAL DOCTORS (MDS) IS PROVIDED BY THE AMERICAN BOARD OF FAMILY MEDICINE. BOARD CERTIFICATION FOR DOCTORS OF OSTEOPATHY (DOS) IS PROVIDED BY THE AMERICAN OSTEOPATHIC BOARD OF FAMILY PHYSICIANS OR THE AMERICAN BOARD OF FAMILY MEDICINE.",FAMILY MEDICINE PHYSICIAN,INDIVIDUAL
207QA0401X,ALLOPATHIC & OSTEOPATHIC PHYSICIANS,FAMILY MEDICINE,ADDICTION MEDICINE,A FAMILY MEDICINE PHYSICIAN WHO SPECIALIZES IN THE DIAGNOSIS AND TREATMENT OF ADDICTIONS.,4/1/2003,,1/1/2010,"SOURCE: NATIONAL UNIFORM CLAIM COMMITTEE, 2009 [1/1/2010: DEFINITION ADDED, SOURCE ADDED]    ADDITIONAL RESOURCES: A CERTIFICATION OF ADDED QUALIFICATIONS (CAQ) WAS, BUT IS NO LONGER ISSUED BY THE AMERICAN OSTEOPATHIC BOARD OF FAMILY PHYSICIANS.",ADDICTION MEDICINE (FAMILY MEDICINE) PHYSICIAN,INDIVIDUAL
